Text,Language
 豊かな文化を誇る。,Japanese
インドの文化は、,Japanese
 マイナーなユニークな文化のコレクション。,Japanese
 インドの文化は,Japanese
 服装、祭り、言語、,Japanese
宗教、音楽、ダンス、建築、,Japanese
 インドの食と芸術。,Japanese
最も注目すべきは、,Japanese
インドの文化は,Japanese
複数の外国人から影響を受ける,Japanese
その歴史を通して文化。,Japanese
 また、その経緯,Japanese
インドの文化の,Japanese
数百万,Japanese
古いレニア。,Japanese
初めに、,Japanese
インド起源の宗教はヒンズー教であり、,Japanese
 仏教、ジャイナ教、シーク教。,Japanese
 これらの宗教はすべて,Japanese
カルマとダルマに基づいています。,Japanese
さらに、この4つは,Japanese
インドの宗教と呼ばれる。,Japanese
 インドの宗教は主要な,Japanese
 世界の宗教のカテゴリ,Japanese
 アブラハムの宗教と。,Japanese
また、多くの外国の宗教は、,Japanese
インドにも存在。,Japanese
これらの外国の宗教,Japanese
アブラハムの宗教を含む。,Japanese
 インドのアブラハム宗教,Japanese
 確かにユダヤ教、,Japanese
 キリスト教、そしてイスラム教。,Japanese
 アブラハムの宗教のほかに、,Japanese
ゾロアスター教とバハイ信仰は,Japanese
他の外国の宗教,Japanese
 インドに存在するもの。,Japanese
 その結果、の存在,Japanese
 非常に多くの多様な宗教が生まれました,Japanese
 寛容と,Japanese
 インド文化における世俗主義。,Japanese
共同家族制度は、,Japanese
 インド文化の支配的なシステム。,Japanese
特筆すべきはご家族様,Japanese
 親、子、,Japanese
子供の配偶者、および子孫。,Japanese
 この家族全員,Japanese
メンバーが一緒に住んでいます。,Japanese
 さらに長男は,Japanese
 男性メンバーは家族の頭です。,Japanese
インドは盛大に祝う,Japanese
 祭りの数。,Japanese
 これらの祭りは非常に多様です,Japanese
 多宗教のせいで,Japanese
 多文化インド社会。,Japanese
 インド人はお祭りをとても大切にします。,Japanese
なにより全国,Japanese
祝賀会に参加します,Japanese
 違いに関係なく。,Japanese
伝統的なインド料理、芸術、,Japanese
 音楽、スポーツ、衣類、,Japanese
 とアーキテクチャは大幅に異なります,Japanese
 さまざまな地域にわたって。,Japanese
 これらのコンポーネントは影響を受けます,Japanese
 さまざまな要因によって。,Japanese
 何よりも、これらの要因は,Japanese
 地理、気候、文化、,Japanese
 そして田舎/都会の設定。,Japanese
インドの文化はインスピレーションを与えてきました,Japanese
 多くの作家に。,Japanese
 インドは確かにシンボルです,Japanese
世界中の団結の。,Japanese
 インドの文化は確かに非常に複雑です。,Japanese
 さらに、,Japanese
インドのアイデンティティの概念,Japanese
 特定の困難をもたらします。,Japanese
 しかし、それにもかかわらず、典型的な,Japanese
 インドの文化は存在します。,Japanese
 この典型的なの作成,Japanese
インドの文化はいくつかの,Japanese
内力。,Japanese
 何よりも、これらの力,Japanese
強固な憲法であり、,Japanese
ユニバーサル アダルト フランチャイズ、世俗的,Japanese
 政策、柔軟な連邦構造など,Japanese
インドの文化が映し出す,Japanese
 信念、社会構造、,Japanese
 および宗教的傾向,Japanese
 インドの人々。,Japanese
インドは文化的に多様な国です,Japanese
 すべての地域で,Japanese
独自の独自の文化、,Japanese
彼の時代の最も偉大な戦士。,Japanese
 革新的な軍事戦術家,Japanese
そして有能な管理者、,Japanese
 彼は勇敢な戦士と見なされます。,Japanese
 彼が持っていた素晴らしい資質,Japanese
指導者と王として、彼が,Japanese
マラーター帝国を強力で巨大な力に。,Japanese
シヴァージー・ボンスルは、,Japanese
 シャハジ・ボンスルの王族。,Japanese
彼は生まれながらのリーダーであり、,Japanese
を確立するために,Japanese
 あのマラーター帝国,Japanese
 強大なムガル帝国さえも恐怖に陥れました。,Japanese
1627年2月16日にシブネリで生まれ、,Japanese
シヴァジーはシャージーの誇り高き息子でした。,Japanese
 このシヴァジー・マハラジのエッセイ,Japanese
 英語で栄光について教えてくれます,Japanese
 国民の王の勇気。,Japanese
シヴァジーの母ジジャバイは,Japanese
個性も強い。,Japanese
 彼女は徳が高く、与えた,Japanese
～するための適切な教育,Japanese
 彼女の息子は彼を大胆不敵にしました。,Japanese
 彼はそれを聞いて育った,Japanese
 の勇気と栄光,Japanese
 ラーマーヤナとマハーバーラタ。,Japanese
彼もその教えに従った,Japanese
これらの2つの叙事詩の,Japanese
強い弾力性の特徴,Japanese
理想的なヒンズー教徒の性格。,Japanese
 彼はお辞儀を習わなかった,Japanese
どんな力にも。,Japanese
このシヴァジー・マハラジのエッセイでは,Japanese
、彼の人生と,Japanese
成果が繰り広げられます。,Japanese
生きる人々のために,Japanese
 ムガル帝国によって滅ぼされ、,Japanese
 チャトラパティ・シヴァージー・マハラジの誕生,Japanese
 吉兆でした。,Japanese
 の苦難の中で,Japanese
ムガル帝国の支配下で、彼は,Japanese
人々の希望の光。,Japanese
 マハラジは2月18日に生まれました,Japanese
ユリウス暦によると 1630 年,Japanese
 そしてファルガン・クリシュナ,Japanese
 トリティヤ（ファルガン・クリシュナ・トリティヤ）,Japanese
 ヒンズー暦によると,Japanese
 ジュナール市のシブネリ砦にて、,Japanese
 プネ地区の近く、シャハジまで,Japanese
ボセールとジジャバイ・ボセール。,Japanese
いくつかの情報を提供しました,Japanese
 シヴァージー・マハラジの生年月日について,Japanese
 この記事の最後に。,Japanese
幼い頃、母親は,Japanese
 ジジャマタは彼を「シバ」と呼んだ。,Japanese
 彼は国王に仕えた,Japanese
 若い頃のビジャプール。,Japanese
 「ジャハギルダー」であるだけでなく、,Japanese
 彼はプネのある地域に住んでいました。,Japanese
 シヴァジーの母、ジジャバイ。,Japanese
 信仰心が深く、,Japanese
 父親を持つ野心的な女性,Japanese
 シンドクヘドの指導者ラクジラオ・ジャダブでした。,Japanese
 真実は勝利する,Japanese
最後に、シヴァジーによれば、,Japanese
それを教えられた人,Japanese
正しいことのために戦う,Japanese
 どんな挑戦でも,Japanese
 あなたが直面することが最も重要です,Japanese
 彼女が子供の頃に彼に教えた教訓。,Japanese
シヴァージーが成長するにつれ、,Japanese
 地ジャマタの教えは,Japanese
 彼の心に大きな影響を与えます。,Japanese
見てみると,Japanese
インドの選挙のシナリオ、,Japanese
 十分な力を持つランダムな人物と,Japanese
お金は選挙に異議を唱えることができます。,Japanese
彼らはただの市民である必要があります,Japanese
 国とそこにいる,Japanese
少なくとも25歳。,Japanese
 いくつかあります,Japanese
非常に簡単な句も。,Japanese
最も奇妙なことは、そのコンテストです,Japanese
選挙のために必要ありません,Japanese
 最低限の教育資格。,Japanese
 したがって、教育を受けていない人がいかに多いかがわかります,Japanese
 そして不適格な候補者,Japanese
権力を握り、それを際限なく悪用します。,Japanese
 教育を受けていない大臣がいる国,Japanese
 開発することも、正しい道を歩むことさえできません。,Japanese
政府には教育を受けた閣僚が必要です。,Japanese
彼らは作ることができる人です,Japanese
彼らが処理するように国は進歩します,Japanese
 文盲のものよりも優れています。,Japanese
 候補者は十分な資格を持っている必要があります,Japanese
大きな責任を負うために,Japanese
 国全体を運営するように。,Japanese
要するに、私たちは国を救う必要があります,Japanese
腐敗した教育を受けていない政治家から,Japanese
食べる寄生虫に劣らない人,Japanese
 の開発成長を離れて,Japanese
国とその資源。,Japanese
 私たち全員が団結して壊さなければなりません,Japanese
 ホイールとワーク,Japanese
 わが国の豊かな未来。,Japanese
新聞の発行部数は,Japanese
17世紀。さまざまな国,Japanese
 開始するタイムラインが異なる,Japanese
 新聞の発行。 1665年、,Japanese
最初の本物の新聞はイギリスで印刷されました。,Japanese
 最初のアメリカの新聞,Japanese
「外国と国内の両方の公共の出来事」と名付けられました,Japanese
 は 1690 年に印刷されました。,Japanese
すべては 1702 年から始まり、カナダでは,Japanese
1752年 最初の新聞の名前,Japanese
 Halifax Gazette が発行を開始しました。,Japanese
19世紀後半、新聞,Japanese
 非常に一般的になり、,Japanese
 のおかげで安く入手できました。,Japanese
 それらに対する印紙税の廃止。しかし、,Japanese
 20世紀初頭、コンピューター技術,Japanese
 印刷の古い労働方法を置き換え始めました。,Japanese
新聞は非常に強力なメディアです,Japanese
人々の間で情報を広めること。,Japanese
 情報は私たちが必要とする非常に重要なものです,Japanese
 私たちの周りで何が起こっているかを知ってください。また、意識,Japanese
 での出来事に,Japanese
私たちの周りが助けてくれる,Japanese
 より良い計画と決定で私たち。,Japanese
政府およびその他,Japanese
公式発表,Japanese
 新聞で行われます。,Japanese
 政府および民間部門,Japanese
 仕事などの雇用関連情報,Japanese
 欠員とさまざまな競合関連,Japanese
情報も,Japanese
 新聞に掲載されました。,Japanese
気象予報、,Japanese
ビジネス関連のニュース、政治、,Japanese
 経済、国際、,Japanese
 スポーツ・エンタメ関連全般,Japanese
 新聞に情報が掲載されています。,Japanese
新聞が理想,Japanese
 増加の源,Japanese
時事問題。ほとんどの家庭では,Japanese
今の社会、朝はから始まる,Japanese
 読む新聞。,Japanese
このデジタル化の時代に、,Japanese
 豊富なデータは,Japanese
インターネットで利用できます。,Japanese
ほとんどのニュース,Japanese
 対応するチャンネルと新聞社,Japanese
 の傾向に合わせて,Japanese
 デジタル化が始まった,Japanese
独自の Web サイトとモバイル アプリケーション。,Japanese
 情報はSNSで瞬時に拡散,Japanese
メディアとウェブサイト。,Japanese
この現在のシナリオでは,Japanese
 どこの情報,Japanese
インターネット上でほぼリアルタイムで利用可能であり、,Japanese
 新聞は元の形のようです,Japanese
の御馳走に直面する,Japanese
存在。しかし、日常、,Japanese
 週刊誌はまだ,Japanese
 これを重要視する,Japanese
 デジタル時代。,Japanese
 新聞はまだ考えられている,Japanese
あらゆる情報の真の情報源として。,Japanese
ほとんどの新聞にも特別な記事があります,Japanese
 若者と学校の学生のためのセクション,Japanese
 彼らの才能を表現し、示すこと。,Japanese
クイズ、エッセイ、,Japanese
 短編小説、絵が掲載されています,Japanese
新聞を作るもの,Japanese
 興味深い記事,Japanese
 学生の間で。,Japanese
教え込みにも役立ちます,Japanese
読書の習慣,Japanese
小さい頃から新聞。,Japanese
新聞は素晴らしい情報源です,Japanese
 という情報,Japanese
自宅で利用できます。,Japanese
 一人一人,Japanese
 確実に吸収しなければならない,Japanese
 読書の習慣,Japanese
 彼らの生活の中で新聞。,Japanese
 今日のデジタル世界では、,Japanese
オンライン情報源,Japanese
容易に入手できますが、,Japanese
 信憑性と信頼性,Japanese
 そのような情報の,Japanese
 知られていません。新聞です,Japanese
 確実に提供する,Japanese
 正確で検証済み,Japanese
 情報。新聞は常設,Japanese
 彼らがされているので,Japanese
 人々の信頼を得ることができる,Japanese
 その検証済みの情報とともに。社会的に、,Japanese
新聞は重要な役割を果たしている,Japanese
 育成と維持,Japanese
 士気と調和,Japanese
 社会をより広く。,Japanese
最もよく知られているの 1 つ,Japanese
インドの尊敬される実業家、,Japanese
 Ratan Naval Tata は、,Japanese
タタ・サンズとタタ・グループ。 73歳の時、,Japanese
 タタは、国内最大の企業の 1 つを率いています。,Japanese
 約100からなるコングロマリット,Japanese
 収益の合計が約,Japanese
 670億米ドル。会長でもある,Japanese
 タタ・スチールなどの大手タタ企業の、,Japanese
 タタ・モーターズ、タタ・テレサービス。力、,Japanese
タタ コンサルタンシー サービス、タタ ティー、,Japanese
 タタ・ケミカルズとザ・,Japanese
インドのホテル会社。,Japanese
タタは 1937 年 12 月 28 日に生まれました。,Japanese
 最も裕福な家族の 1 つであるムンバイ。,Japanese
 彼の曽祖父はジャムセジ・タタでした。,Japanese
 タタグループの創始者。少年時代、,Japanese
 タタは乱れた,Japanese
両親が別れた後の子供時代。,Japanese
 彼は祖母に育てられ、,Japanese
タタ パレスで贅沢なひとときを過ごすレディ ナヴァイバイ。,Japanese
 アメリカは特別な魅力を持っていました,Japanese
タタの末裔と彼はコーネル大学に行きました,Japanese
 建築と構造工学を学ぶ。,Japanese
 その後、管理職に就く,Japanese
ハーバード大学のコース。,Japanese
タタは後になる道を開いた,Japanese
タタ・インダストリーズ会長,Japanese
 そして先導に尽力しました,Japanese
幅広い改革に。,Japanese
それは彼の管理下にあった,Japanese
 タタ コンサルタンシー サービスが上場,Japanese
タタ・モーターズが上場,Japanese
 ニューヨーク証券取引所の寄付,Japanese
それはより国際的な力と認識です。,Japanese
 彼はリーダーとして認められています,Japanese
 Tatas の Corus の落札,Japanese
 英蘭の鉄鋼とアルミニウムの生産者,Japanese
ジャガーやランドローバーも,Japanese
フォード社のブランド。,Japanese
在職中、同社は,Japanese
インドの打ち上げに立ち会った,Japanese
 最初の真のインド車「インディカ」。,Japanese
 車はタタの発案によるものでした。,Japanese
 2000年にタタの食品部門が買収,Japanese
7000万ポンドのお茶会社Tetley。,Japanese
2009-10 年におけるグループの収益,Japanese
 約12倍に成長し、,Japanese
総額 674 億米ドル。,Japanese
 タタも,Japanese
 Fiat SpA と Alcoa の取締役会と,Japanese
 国際にもあります,Japanese
 三菱商事の取締役会、,Japanese
 アメリカン・インターナショナル・グループ、,Japanese
 JPモルガン・チェース、ロールス・ロイス、,Japanese
 テマセク・ホールディングスと通貨,Japanese
 シンガポール当局。,Japanese
2000年に、彼は名誉を与えられました,Japanese
 パドマ・ブーシャン,Japanese
 インド政府。,Japanese
 彼はまた、,Japanese
名誉博士号,Japanese
 経営学で,Japanese
オハイオ州立大学、,Japanese
名誉博士号,Japanese
アジア研究所による技術,Japanese
 技術学部、バンコク、,Japanese
そして名誉博士号,Japanese
 ワーウィック大学による科学。,Japanese
タタには個人的な,Japanese
 3億ポンドの財産,Japanese
の 1% 未満しか所有していません。,Japanese
巨人集団。,Japanese
Tata Group の 3 分の 2 以上は、,Japanese
慈善団体が所有,Japanese
善意に資金を提供する信託。,Japanese
タタ・セット・ア・パーフェクト,Japanese
 寛大さの例と,Japanese
 26/11 攻撃中のリーダーシップ。,Japanese
 武装していない彼は、家の外に一人で立っていた,Japanese
タージホテルとアクティビティを監督,Japanese
 被害者を助けるために。彼は自分の作品を披露した,Japanese
 個人的に訪問することによる人道的なジェスチャー,Japanese
 80名の従業員の家族,Japanese
 死亡または負傷した。彼は一石を投じた,Japanese
 被害者に救済を提供するために、,Japanese
 家族と扶養家族,Japanese
彼らが彼に何をして欲しかったかについて。,Japanese
彼の引退はまだ1年先かもしれませんが、,Japanese
 しかし、タタはチョーキングを始めました,Japanese
彼の退職後の計画を立てます。,Japanese
 彼はデザインを設定する予定です,Japanese
 国際基準と規模の中心。,Japanese
多くの開発をリードしてきた,Japanese
革新的なデザインと製品、,Japanese
 最も有名なのはナノです。,Japanese
ナノのアイデアは彼から生まれました,Japanese
 原子力の安全性への懸念,Japanese
 二輪車通勤の家族。,Japanese
 と提案したのは彼でした。,Japanese
 ミニチュアカーを装着する必要があります,Japanese
フロントガラスのワイパーが1つだけ。,Japanese
これで値下げしました,Japanese
 そして維持費。,Japanese
英文法を教えることは役に立ちます,Japanese
 取得する学生,Japanese
リスニングのスキル、,Japanese
 話す、読む,Japanese
 と書く。,Japanese
文法の知識がなくても、,Japanese
学生は話すことができません,Japanese
 または英語を正しく書く。,Japanese
 文法は重要な役割を果たします,Japanese
あらゆる言語を教え、学ぶ。,Japanese
 政府はその重要性を認識した,Japanese
 重要な部分としての文法,Japanese
 言語教育の。,Japanese
 文法はこうなった,Japanese
の重要な部分,Japanese
学校の英語カリキュラム,Japanese
 初等教育から高等教育まで。,Japanese
 文法は基本,Japanese
英語,Japanese
 そしてそれは基本です,Japanese
教育の一部と,Japanese
 英語の文法を学ぶ,Japanese
 ブータン教室にて。,Japanese
学校の英語カリキュラムは分かれています,Japanese
 英語を次のような 4 つの主要なスキルに変換します。,Japanese
話すこと、聞くこと、書くこと、,Japanese
 読書と文学と言語,Japanese
就学前からクラス 12 まで,Japanese
生徒が適切な方法で学習できるようにします。,Japanese
 したがって、このエッセイでは、その方法について説明します。,Japanese
 英文法の指導と学習,Japanese
教室の設定で正式な方法で,Japanese
 学生がリスニングを習得するのを助け、,Japanese
 スピーキング、リーディング、ライティングのスキル。,Japanese
 最も広い意味での自然は自然であり、,Japanese
 物理的、物質的な世界または宇宙。,Japanese
「自然」は物理世界の現象を指すことができ、,Japanese
 また、一般的な生活にも。,Japanese
自然の研究は、科学の一部ではないにしても、大きな部分を占めています。,Japanese
人間は自然の一部ですが、,Japanese
 人間の活動は、他の自然現象とは別のカテゴリーとして理解されることがよくあります。,Japanese
[1] 自然という言葉は古フランス語の自然から借用され、ラテン語のナチュラに由来します。,Japanese
または「本質的な資質、,Japanese
 生来の気質」であり、古代では、,Japanese
文字通り「誕生」を意味します。,Japanese
[2] 古代哲学では、natura は主にギリシャ語の phys (Ï†ÏÏƒÎ¹Ï‚) のラテン語訳として使用されています。,Japanese
もともとは植物の固有の特性に関連していましたが、,Japanese
 動物やその他の世界の特徴は、自然に発達します。,Japanese
全体としての自然の概念、物理的宇宙は、いくつかの概念の 1 つです。,Japanese
 元の概念の拡張;[1],Japanese
 それは、Ï†ÏÏƒÎ¹Ï‚という単語の特定のコアアプリケーションから始まりました。,Japanese
 ソクラテス以前の哲学者たちによって (この言葉は動的な次元を持っていましたが、,Japanese
 特にヘラクレイトス)、,Japanese
 それ以来、着実に通貨を獲得してきました。」,Japanese
過去数世紀における現代の科学的方法の出現の間、,Japanese
 自然は受動的な現実になり、,Japanese
 神の法則によって組織され、動かされます。,Japanese
[5][6] 産業革命により、,Japanese
 自然はますます次のように見られるようになりました,Japanese
意図的な介入から奪われた現実の部分:,Japanese
したがって、いくつかの伝統では神聖であると考えられていました（ルソー、,Japanese
アメリカの超越主義）または神の摂理のための単なる礼儀作法,Japanese
 または人類の歴史（ヘーゲル、マルクス）。,Japanese
しかし、バイタリストの自然のヴィジョンは、プレソクラテスに近いものであり、,Japanese
 特にチャールズ・ダーウィン以降は、同時に生まれ変わりました。,Japanese
[1] 今日の言葉のさまざまな用途の中で、,Japanese
 「自然」は、​​地質学や野生生物を指すことがよくあります。,Japanese
自然は、生きている植物や動物の一般的な領域を指すことができます。,Japanese
 そして場合によっては、無生物に関連するプロセスに,Japanese
 オブジェクト - 特定の種類のものが存在し、それ自体が変化する方法,Japanese
 地球の天気や地質など。,Japanese
多くの場合、「自然環境」または荒野、野生動物、岩、森、,Japanese
 そして一般的に、人間の介入によって実質的に変更されていないもの、,Japanese
または人間の介入にもかかわらず持続するもの。,Japanese
たとえば、人工物や人間の相互作用は、一般的に自然の一部とは見なされません。,Japanese
 たとえば、「人間の本性」または「自然の全体」として修飾されていない限り。,Japanese
このより伝統的な自然物の概念は、,Japanese
今日発見されていることは、自然と人工の区別を暗示しています。,Japanese
 人工物とは、人間の意識または人間の心によって生み出されたものとして理解されています。,Japanese
特定のコンテキストに応じて、,Japanese
 「自然」という用語は、不自然または超自然と区別される場合もあります。,Japanese
[1] 地球は生命を維持することが知られている唯一の惑星であり、,Japanese
 そしてその自然の特徴は、科学研究の多くの分野の主題です。,Japanese
太陽系内では、,Japanese
 太陽に3番目に近いです。,Japanese
 それは最大の地球型惑星であり、全体で 5 番目に大きいです。,Japanese
その最も顕著な気候的特徴は、その 2 つの大きな極域です。,Japanese
 2 つの比較的狭い温帯、,Japanese
そして広い赤道熱帯から亜熱帯地域。,Japanese
[7] 降水量は場所によって大きく異なります。,Japanese
 年間数メートルから 1 ミリ未満の水まで。,Japanese
地球の表面の 71% は塩水の海で覆われています。,Japanese
残りは大陸と島々で構成され、,Japanese
 北半球の居住地のほとんどで。,Japanese
地球は、地質学的および,Japanese
 元の状態の痕跡を残した生物学的プロセス。,Japanese
外面は、徐々に移動するいくつかの構造プレートに分かれています。,Japanese
インテリアはアクティブなまま、,Japanese
