Text,Language
それ以来、Plantae が,Japanese
 当初定義されたいくつかの無関係なグループが含まれていましたが、,Japanese
菌類と藻類のいくつかのグループは、新しい王国に移されました。,Japanese
ただし、これらは依然として多くの文脈で植物と見なされることがよくあります。,Japanese
細菌の生命は時に植物相に含まれますが、,Japanese
[71][72] およびいくつかの分類では、細菌という用語を使用しています,Japanese
植物相とは別の植物相。,Japanese
植物を分類する多くの方法の中には、,Japanese
 研究の目的に応じて、地域の植物相、,Japanese
 化石フローラ、前の時代からの植物生命の残骸も含まれる場合があります。,Japanese
多くの地域や国の人々は、,Japanese
 特徴的な植物相の個々の配列、,Japanese
 これは、違いにより世界中で大きく異なる可能性があります,Japanese
 気候と地形で。,Japanese
地域の植物相は、通常、在来植物相などのカテゴリに分類されます,Japanese
農業および園芸植物、,Japanese
 最後に言及したものは、意図的に栽培および栽培されています。,Japanese
いくつかの種類の「在来植物」は、実際には何世紀も前に導入されました,Japanese
ある地域や大陸から別の地域や大陸に移動する人々によって、,Japanese
 ネイティブの不可欠な部分になり、,Japanese
 またはそれらが導入された場所の自然の植物。,Japanese
これは人間の相互作用の例です,Japanese
自然との境界は、自然と見なされるものの境界を曖昧にする可能性があります。,Japanese
植物の別のカテゴリーは、歴史的に雑草のために切り分けられてきました。,Japanese
この用語は嫌われていますが,Japanese
「役に立たない」植物を分類するための正式な方法として植物学者の間で、,Japanese
と見なされる植物を表す「雑草」という言葉の非公式な使用,Japanese
排除に値するのは、人々の一般的な傾向を示しており、,Japanese
 自然の流れを変えたり形作ったりしようとする社会。,Japanese
同様に、動物はしばしば、家畜、農場の動物、,Japanese
 野生動物、害虫など,Japanese
人間の生活との関係によると。,Japanese
カテゴリーとしての動物にはいくつかの特徴があります,Japanese
 それは一般的にそれらを他の生物から区別します。,Japanese
動物は真核生物で、通常は多細胞です,Japanese
 （粘液虫を参照してください）、それらを分離します,Japanese
細菌、古細菌、およびほとんどの原生生物から。,Japanese
彼らは従属栄養であり、一般的に食物を消化します,Japanese
 植物や藻類からそれらを分離する内部チャンバーで。,Japanese
それらはまた、植物、藻類、,Japanese
細胞壁の欠如による菌類。,Japanese
いくつかの例外はありますが、最も顕著なのは、,Japanese
 スポンジとプラコゾアン - 動物は組織に分化した体を持っています.,Japanese
これらには、収縮して移動を制御できる筋肉が含まれます。,Japanese
 信号を送信して処理する神経系。,Japanese
通常、内部消化室もあります。,Japanese
すべての動物が持つ真核細胞は、,Japanese
 コラーゲンと弾性糖タンパク質で構成される特徴的な細胞外マトリックス。,Japanese
これは石灰化して、殻、骨、骨片などの構造を形成することがあります。,Japanese
細胞が動き回り、再編成されるフレームワーク,Japanese
 発達と成熟をサポートし、可動性に必要な複雑な解剖学的構造をサポートします。,Japanese
人間は、地球上の全生物バイオマスのごくわずかな割合しか占めていませんが、,Japanese
 自然に対する人間の影響は不釣り合いに大きい。,Japanese
人間の影響の範囲のために、何の間の境界,Japanese
 人は自然を「作った環境」とみなす,Japanese
 極端な場合を除いて明確ではありません。,Japanese
極限でも、自然環境の量,Japanese
 識別可能な人間の影響を受けていないことは、,Japanese
 ますます速いペースで減少しています。,Japanese
人類による技術の発展は、,Japanese
 天然資源のより大きな搾取と助けてきた,Japanese
 自然災害によるリスクの一部を軽減します。,Japanese
しかし、この進歩にもかかわらず、人類の運命は,Japanese
文明は環境の変化と密接に結びついています。,Japanese
の使用の間には非常に複雑なフィードバック ループが存在します。,Japanese
 ゆっくりと理解されつつある高度な技術と環境への変化。,Japanese
[73] 地球の自然環境に対する人為的な脅威には、汚染、森林伐採、,Japanese
 油流出などの災害。,Japanese
人間は、多くの動植物の絶滅に貢献してきました。,Japanese
人間は余暇と経済活動の両方で自然を利用しています。,Japanese
産業利用のための天然資源の取得は依然として,Japanese
 世界の経済システムのかなりの部分。,Japanese
[74][75] 狩猟や釣りなどの一部の活動が使用されている,Japanese
栄養と余暇の両方のために、しばしば異なる人々によって。,Japanese
農業が最初に採用されたのは、紀元前 9 千年紀頃です。,Japanese
食糧生産からエネルギーに至るまで、自然は経済的富に影響を与えます。,Japanese
初期の人類は栽培されていない植物材料を集めましたが、,Japanese
植物の薬効成分を治癒に利用し、,Japanese
[76] 植物の最も現代的な人間の使用は、農業によるものです。,Japanese
作物の成長のための広大な土地の開墾は、,Japanese
 森林と湿地の利用可能な量の大幅な減少、,Japanese
 その結果、多くの植物の生息地が失われました,Japanese
 および動物種、ならびに侵食の増加。,Japanese
[77] 自然の美しさは、歴史的に芸術や本で広く使われているテーマであり、,Japanese
図書館や書店の大部分を埋め尽くしています。,Japanese
その自然は多くの芸術によって描かれ、祝われてきました。,Japanese
 写真、詩、,Japanese
 および他の文献は、多くの人が持つ強さを示しています,Japanese
 人々は自然と美を関連付けます。,Japanese
この協会が存在する理由、および協会が構成するもの、,Japanese
 美学と呼ばれる哲学の一分野によって研究されています。,Japanese
多くの特定の基本的な特性を超えて,Japanese
 哲学者たちは、何が美しいと見なされるかを説明することに同意します。,Japanese
 意見は事実上無限です。,Japanese
[78] 自然と野生は重要だった,Japanese
 世界史のさまざまな時代の主題。,Japanese
風景画の初期の伝統は中国で始まりました,Japanese
 唐の時代 (618–907)。,Japanese
自然をありのままに表現する伝統は、,Japanese
 中国絵画の目的であり、アジア美術に大きな影響を与えました。,Japanese
自然の驚異は詩篇とヨブ記で祝われていますが、,Japanese
芸術における荒野の描写は、1800 年代に一般的になりました。,Japanese
 特にロマン派の作品に。,Japanese
英国のアーティスト、ジョン・コンスタブルと J. M. W. ターナーが,Japanese
 自然界の美しさを絵画に捉えることに注意を払っています。,Japanese
それ以前は、絵画は主に宗教的なシーンや人間を描いたものでした。,Japanese
ウィリアム・ワーズワースの詩は自然界の驚異を描写した,Japanese
、以前は脅威的な場所と見なされていました。,Japanese
自然を大切にすることは、ますます西洋文化の一面になりました。,Japanese
[79] この芸術運動は、,Japanese
 西洋世界における超越主義運動。,Japanese
美しい芸術の一般的な古典的な考えには、,Japanese
 ミメーシスという言葉、自然の模倣。,Japanese
また、自然の美しさについてのアイデアの領域では、,Japanese
完全なものは完全な数学的形式によって暗示され、,Japanese
より一般的には、自然のパターンによって。,Japanese
David Rothenburg が書いているように、「美しいものは科学の根源であり、芸術の目標です。,Japanese
 人類が望むことができる最高の可能性」.,Japanese
[80]:281 科学の分野によっては、自然を動いているものと見なしている。,Japanese
 科学が理解しようとする特定の自然の法則に従うこと。,Japanese
このため、最も基本的な科学は一般的に,Japanese
 「物理学」と理解される - その名前は,Japanese
それが「自然の研究」であることを意味するものとして今でも認識されています。,Japanese
物質は一般に、物理的なオブジェクトを構成する物質として定義されます。,Japanese
それは観測可能な宇宙を構成します。,Japanese
宇宙の目に見える構成要素は現在信じられている,Japanese
 総質量のわずか 4.9% を構成します。,Japanese
残りは 26.8% の風邪で構成されていると考えられています。,Japanese
暗黒物質と 68.3% の暗黒エネルギー。,Japanese
[81] これらのコンポーネントの正確な配置はまだ,Japanese
不明であり、物理学者によって集中的に調査されています。,Japanese
観測可能なもの全体での物質とエネルギーの挙動,Japanese
 宇宙は明確に定義された物理法則に従っているように見えます。,Japanese
これらの法則は、宇宙モデルを作成するために採用されています,Japanese
 構造をうまく説明し、,Japanese
私たちが観測できる宇宙の進化。,Japanese
物理法則の数式は、20 の物理定数のセットを使用します[82]。,Japanese
 観測可能な宇宙全体で静的であるように見えます。,Japanese
[83] これらの定数の値は注意深く測定されています。,Japanese
 しかし、その特定の値の理由は謎のままです。,Japanese
単に宇宙とも呼ばれる宇宙空間は、相対的なものを指します。,Japanese
天体の大気の外にある宇宙の空の領域。,Japanese
宇宙空間は、空域 (および地上の場所) と区別するために使用されます。,Japanese
地球の大気と宇宙の間に明確な境界はありません。,Japanese
高度が上がるにつれて大気が徐々に減衰するためです。,Japanese
太陽系内の宇宙空間は惑星間空間と呼ばれ、,Japanese
 これは、ヘリオポーズとして知られている星間空間に移動します。,Japanese
宇宙空間には数十種類の生物がまばらに満ちている,Japanese
 これまでにマイクロ波分光法で発見された有機分子、,Japanese
 ビッグバンから残った黒体放射,Japanese
 宇宙の起源、宇宙線、,Japanese
 これには、イオン化された原子核とさまざまな亜原子粒子が含まれます。,Japanese
いくつかのガス、プラズマ、ほこり、および小さな流星もあります。,Japanese
さらに、今日の宇宙空間には人間の生命の兆候があり、,Japanese
以前の有人からの残り物など,Japanese
宇宙船に危険を及ぼす可能性のある無人打ち上げ。,Japanese
この破片の一部は定期的に大気圏に再突入します。,Japanese
地球は生命を維持することが知られている太陽系内の唯一の物体ですが、,Japanese
 証拠は、遠い過去に、,Japanese
 火星の表面には液体の水が存在していました。,Japanese
[84] 火星の歴史の短い期間、生命を形成することもできた可能性がある.,Japanese
しかし現在、火星に残っている水のほとんどは凍っています。,Japanese
火星に生命が存在する場合、その可能性が最も高い,Japanese
 液体の水がまだ存在できる地下に配置されます。,Japanese
[85] 他の地球型惑星の状態、,Japanese
 水星と金星は、私たちが知っている生命を維持するには厳しすぎるようです。,Japanese
しかし、木星の4番目に大きな月であるエウロパは、,Japanese
 地下に液体の水の海がある可能性があり、生命を宿す可能性があります。,Japanese
[86] 天文学者は、太陽系外の地球類似物を発見し始めました。,Japanese
 恒星を取り囲むハビタブルゾーンにある惑星,Japanese
ウィキペディアは、2001 年 1 月 15 日にジミー ウェールズとラリー サンガーによって開始されました。,Japanese
サンガーは、「ウィキ」と「百科事典」のかばん語としてその名前を作り出しました[5][6]。,Japanese
当初は英語の百科事典でしたが、他の言語のバージョンがすぐに開発されました。,Japanese
620 万の記事がある英語版ウィキペディアは、317 のウィキペディア百科事典の中で最大のものです。,Japanese
[8][9] ウィキペディアは、その不均一な正確さと、ジェンダーバイアスを含む体系的なバイアスを示していることで批判されてきました。,Japanese
 編集者の大半は男性です。,Japanese
[4] 女性編集者を激励するエディット・アソンを開催,Japanese
女性のトピックの報道を増やします。,Japanese
[12] 他の共同オンライン百科事典は、ウィキペディアの前に試みられましたが、成功したものはありませんでした。,Japanese
[14] 2000 年 3 月 9 日に、Web ポータル会社である Bomis の所有の下に設立されました。,Japanese
その主な人物は、Bomis の CEO である Jimmy Wales と、Nupedia とその後の Wikipedia の編集長である Larry Sanger でした。,Japanese
[17] ウェールズは、公的に編集可能な百科事典を作成するという目標を定義したとされています。,Japanese
[18][19] 一方、サンガーはウィキを使用してその目標を達成するという戦略を立てたとされています。,Japanese
[21] ドメイン wikipedia.com と wikipedia.org は、2001 年 1 月 12 日 [22] と 1 月 13 日に登録されました。,Japanese
 2001 年、[23] それぞれ、ウィキペディアは 1 月 15 日に開始されました。,Japanese
 2001 年、[14] www.wikipedia.com で単一の英語版として [24]、Nupedia メーリング リストで Sanger によって発表されました。,Japanese
[18] ウィキペディアの「中立的な視点」[25] のポリシーは、最初の数か月で成文化されました。,Japanese
そうでなければ、当初は比較的ルールが少なく、Wikipedia は Nupedia とは独立して運営されていました。,Japanese
[18] もともと、ボミスはウィキペディアを営利目的のビジネスにするつもりでした。,Japanese
[26] ウィキペディアは、Nupedia、Slashdot の投稿、および Web 検索エンジンのインデックス作成から初期の貢献者を獲得しました。,Japanese
2004 年末までに合計 161 の言語版も作成されました。,Japanese
[27] Nupedia と Wikipedia は、前者のサーバーが 2003 年に完全にダウンするまで共存していました。,Japanese
 そのテキストはウィキペディアに組み込まれました。,Japanese
