Text,Language
 プラスチックマントルの厚い層と、磁場を生成する鉄で満たされたコアを備えています。,Japanese
この鉄芯は固体の内相で構成されており、,Japanese
 そして流動的な外相。,Japanese
コア内の対流運動がダイナモ作用により電流を発生させ、,Japanese
 そして、これらが地磁気を発生させます。,Japanese
大気条件は著しく,Japanese
 生命体の存在によって元の状態から変化し、,Japanese
[8] 表面状態を安定させる生態学的なバランスを作り出します。,Japanese
緯度やその他の地理的要因による気候の地域差は大きいものの、,Japanese
 間氷期の間、長期的な平均的な地球の気候は非常に安定しています。,Japanese
 および平均的な地球規模の 1 度または 2 度の変動,Japanese
 温度は歴史的に生態系のバランスに大きな影響を与えてきました。,Japanese
 そして地球の実際の地理について。,Japanese
[10][11] 地質学は科学であり、,Japanese
地球を構成する固体と液体の物質の研究。,Japanese
地質学の分野は、組成、構造、,Japanese
 物性、ダイナミクス、,Japanese
 と地球物質の歴史、,Japanese
 そしてそれらが形成され、動かされ、変化するプロセス。,Japanese
この分野は主要な学問分野であり、,Japanese
また、鉱物や炭化水素の抽出にも重要です。,Japanese
 自然災害に関する知識と緩和,Japanese
 いくつかの地盤工学分野、,Japanese
 過去の気候や環境を理解する。,Japanese
地域の地質は岩石単位として時間とともに進化します,Japanese
堆積および挿入され、変形プロセスによって形状と位置が変化します。,Japanese
岩石ユニットは、上に堆積することによって最初に設置されます,Japanese
 表面または上にある岩に侵入します。,Japanese
堆積物が表面に沈むと堆積物が発生する可能性があります,Japanese
 地球の、そして後に堆積岩に石化する、,Japanese
 または、火山灰や溶岩などの火山性物質が地表を覆うとき。,Japanese
バソリス、ラコリス、堤防、敷居などの火成貫入,Japanese
 上にある岩に押し上げ、,Japanese
 侵入すると結晶化します。,Japanese
最初の一連の岩石が堆積した後、,Japanese
岩石ユニットは、変形および/または変成することができます。,Japanese
変形は通常、水平短縮の結果として発生します。,Japanese
 水平方向の延長、または左右 (ストライク-スリップ) の動き。,Japanese
これらの構造レジームは、収束境界に広く関連しています。,Japanese
 異なる境界、,Japanese
 および構造プレート間の境界をそれぞれ変換します。,Japanese
地球は 4.54Â を形成したと推定されます,Japanese
10億年前の太陽系星雲から、,Japanese
 太陽や他の惑星と一緒に。,Japanese
最初に溶けた地球の外層は冷やされ、,Japanese
 固い地殻ができます。,Japanese
ガス放出と火山活動が原始大気を作り出した。,Japanese
凝縮水蒸気、そのほとんどまたはすべては、彗星によって運ばれた氷に由来し、,Japanese
 海やその他の水源を生み出しました。,Japanese
[13] 非常にエネルギーの高い化学は、,Japanese
 約 40 億年前に自己複製分子を生成しました。,Japanese
[14] 大陸が形成され、その後分裂し、再形成された,Japanese
 地球の表面は何億年もかけて形を変え、,Japanese
 時々結合して超大陸を作る。,Japanese
およそ 7 億 5000 万年前、知られている最古の超大陸ロディニア,Japanese
 バラバラになり始めました。,Japanese
大陸は後に再結合してパンノティアを形成しました,Japanese
 約5億4000万年前に分裂し、,Japanese
 そして最後に、約 1 億 8000 万年前に分裂したパンゲアです。,Japanese
[16] 新原生代、凍結,Japanese
気温は氷河と氷床で地球の大部分を覆っていました。,Japanese
この仮説は「スノーボールアース」と呼ばれ、,Japanese
 それが先行するので、それは特に興味深いです,Japanese
多細胞のカンブリア爆発,Japanese
生命体は約 5 億 3000 万から 5 億 4000 万年前に増殖し始めました。,Japanese
[17] カンブリア紀の爆発以来、明確に識別可能な5回の大量絶滅がありました。,Japanese
[18] 最後の大量絶滅は約 6600 万年前に発生しました。,Japanese
 隕石の衝突がおそらく絶滅の引き金となったとき,Japanese
 鳥類以外の恐竜やその他の大型爬虫類、,Japanese
 しかし、哺乳類などの小動物は避けました。,Japanese
[19] 数百万年前、,Japanese
 アフリカの小さな類人猿は、直立する能力を獲得しました。,Japanese
[15] その後の人類の出現、,Japanese
そして農業の発展とさらなる文明は人間を可能にしました,Japanese
 これまでのどの生命体よりも急速に地球に影響を与え、,Japanese
地球規模の気候だけでなく、他の生物の性質と量の両方に影響を与えます。,Japanese
比較すると、大酸素化イベントは、,Japanese
 シデリアン期の藻類の増殖によって生成された、,Japanese
頂点に達するまでに約 3 億年かかりました。,Japanese
現代は大量絶滅イベントの一部として分類されていますが、,Japanese
 完新世の絶滅イベント、,Japanese
 過去最速で発生。,Japanese
[20][21] ハーバード大学の E. O. ウィルソンなど、,Japanese
 人間による生物圏の破壊は、,Japanese
 今後 100 年以内にすべての種の半分が絶滅する。,Japanese
[22] 現在の絶滅イベントの範囲はまだ調査中ですが、,Japanese
生物学者によって議論され、計算されました。,Japanese
[23][24][25] 地球の大気は、生態系を維持する上で重要な要素です。,Japanese
地球を覆っているガスの薄い層は、重力によって所定の位置に保持されています。,Japanese
空気は主に窒素、酸素、水蒸気、,Japanese
 はるかに少量の二酸化炭素、アルゴンなどで。,Japanese
大気圧は高度とともに着実に低下します。,Japanese
オゾン層は、枯渇に重要な役割を果たします,Japanese
 表面に到達する紫外線 (UV) 放射の量。,Japanese
DNAは紫外線によってダメージを受けやすいため、,Japanese
 これは、地表での生命を保護するのに役立ちます。,Japanese
大気は夜間も熱を保持し、,Japanese
 これにより、毎日の極端な気温が低下します。,Japanese
地上の天気は、ほぼ大気の下部でのみ発生します。,Japanese
 熱を再分配するための対流システムとして機能します。,Japanese
[26] 海流は、気候を決定するもう 1 つの重要な要素です。,Japanese
 特に主要な水中熱塩循環,Japanese
 赤道海域から極域に熱エネルギーを分配します。,Japanese
これらの流れは緩和するのに役立ちます,Japanese
 温帯における冬と夏の温度差。,Japanese
また、海流と大気による熱エネルギーの再分配がなければ、,Japanese
 熱帯地方はもっと暑く、極地はもっと寒いでしょう。,Japanese
天候は、有益な影響と有害な影響の両方をもたらす可能性があります。,Japanese
竜巻やハリケーン、サイクロンなどの異常気象,Japanese
 経路に沿って大量のエネルギーを消費し、荒廃をもたらす可能性があります。,Japanese
地表植生は、季節的な天候の変化に依存して進化してきました。,Japanese
 ほんの数年続く突然の変化が劇的な影響を与える可能性があります。,Japanese
 植物と、その成長を食物として依存している動物の両方に。,Japanese
気候は、天候の長期的な傾向の尺度です。,Japanese
さまざまな要因が気候に影響を与えることが知られていますが、,Japanese
 海流をはじめ、,Japanese
 表面アルベド、温室効果ガス、,Japanese
 太陽の明るさの変化、,Japanese
 そして地球の軌道に変わります。,Japanese
歴史的な記録に基づいて、地球は,Japanese
 過去に氷河期を含む劇的な気候変動を経験しました。,Japanese
地域の気候は多くの要因に左右されますが、,Japanese
 特に緯度。,Japanese
同様の気候属性を持つ表面の緯度帯は、気候地域を形成します。,Japanese
そういう地域はいくらでもありますが、,Japanese
 赤道直下の熱帯気候から、北極と南極の極地気候まで、さまざまです。,Japanese
天気も季節に左右されますが、,Japanese
 これは、地球の軸が軌道面に対して傾いていることに起因します。,Japanese
このように、夏でも冬でもいつでも、,Japanese
 地球の一部は、太陽光線に直接さらされています。,Japanese
この露出は、地球がその軌道を公転するにつれて交互になります。,Japanese
季節を問わず、いつでも、,Japanese
 北半球と南半球では季節が反対になります。,Japanese
天候は、環境への小さな変化によって容易に変更される混沌としたシステムです。,Japanese
 そのため、正確な天気予報は数日間に限られています。,Japanese
[27] 全体として、2 つのことが世界中で起こっています。,Japanese
 (1) 気温が平均的に上昇している。,Japanese
 (2) 地域の気候は顕著な変化を遂げています。,Japanese
[28] 水は化学物質であり、,Japanese
 水素と酸素 (H2O) であり、既知のすべての生命体にとって不可欠です。,Japanese
[29] 通常の用法では、水はその液体の形態または状態のみを指します。,Japanese
 しかし、物質には固体、氷、,Japanese
気体状態、水蒸気、または蒸気。,Japanese
水は地球の表面の 71% を覆っています。,Japanese
[30] 地球上では、主に海やその他の大きな水域に見られます。,Japanese
 帯水層の地下水 1.6%、空気中の 0.001% を蒸気として、,Japanese
 雲、および降水量。,Japanese
[31][32] 海は地表水の 97%、氷河、極地の氷冠は 2.4% を占めています。,Japanese
 そして川のような他の陸表水、,Japanese
 湖、および池 0.6%。,Japanese
さらに、微量の地球の水は,Japanese
生体や製品に含まれる。,Japanese
海洋は主要な塩水域であり、水圏の主成分です。,Japanese
慣習的にいくつかの主要な海と小さな海に分けられる連続した水域。,Japanese
平均海洋塩分は約 35 パーツ パー 千 (ppt) (3.5%) です。,Japanese
また、ほぼすべての海水の塩分濃度は 30 ～ 38 ppt の範囲です。,Japanese
一般に、いくつかの「別々の」海洋として認識されていますが、これらの海域は 1 つの地球規模の海洋を構成しています。,Japanese
 相互接続された塩水域は、しばしば世界の海または地球の海と呼ばれます。,Japanese
[33][34] 連続体としての地球規模の海洋のこの概念,Japanese
 その部分の間で比較的自由に交換できる水の構造は、海洋学にとって基本的に重要です。,Japanese
[35] 主要な海洋区分は、大陸によって部分的に定義されています。,Japanese
さまざまな群島、およびその他の基準:,Japanese
 これらの区画は（サイズの降順で）太平洋です。,Japanese
 大西洋、インド洋、南洋、北極海。,Japanese
海の小さな領域は、海、湾、湾などの名前で呼ばれます。,Japanese
塩湖もあり、,Japanese
 これは、世界の海と相互接続されていない内陸の海水の小さな塊です。,Japanese
塩湖の 2 つの注目すべき例は、アラル海とグレート ソルト レイクです。,Japanese
湖 (ラテン語の lacus から) は、地形の特徴 (または物理的な特徴) です。,Japanese
 盆地の底に局所化された世界の表面上の液体の塊,Japanese
 (別のタイプの地形または地形フィーチャ。つまり、,Japanese
 グローバルではありません）、移動する場合はゆっくりと移動します。,Japanese
地球上では、内陸にある水域は湖と見なされますが、,Japanese
海の一部ではなく、,Japanese
 池よりも大きくて深く、川から水が流れています。,Japanese
[36][37] 地球以外に湖があることが知られている唯一の世界はタイタンである。,Japanese
 土星の最大の月にはエタンの湖があり、メタンと混合している可能性が最も高い.,Japanese
タイタンの湖が川から供給されているかどうかは不明ですが、,Japanese
タイタンの表面は無数の川床に刻まれています。,Japanese
地球上の自然湖は、一般的に山岳地帯、リフトゾーン、,Japanese
 進行中または最近の氷河作用のある地域。,Japanese
他の湖は、内陸盆地や成熟した川の流れに沿って見られます。,Japanese
世界のいくつかの地域では、,Japanese
最後の氷河期から残った混沌とした排水パターンのために、多くの湖があります。,Japanese
すべての湖は、地質学的な時間スケールでは一時的なものです。,Japanese
 それらはゆっくりと堆積物で満たされるか、それらを含む盆地からこぼれます。,Japanese
池は、自然または人工の水溜まりです。,Japanese
 それは通常、湖よりも小さいです。,Japanese
さまざまな人工の水域が池として分類されます。,Japanese
審美的な装飾のために設計されたウォーター ガーデンを含む、,Japanese
 商業魚飼育用に設計された養魚池、,Japanese
 熱エネルギーを蓄えるように設計されたソーラー池。,Japanese
池や湖は、流速によって小川と区別されます。,Japanese
河川の流れは簡単に観察できますが、,Japanese
 池や湖には、熱によって駆動されるマイクロカレントと適度な風によって駆動されるカレントがあります。,Japanese
これらの特徴は、池を他の多くの水生地形の特徴と区別します。,Japanese
ストリームプールやタイドプールなど。,Japanese
川は自然の水路であり[38]、通常は淡水である。,Japanese
 海、湖、海、または別の川に向かって流れます。,Japanese
いくつかのケースでは、川が単に地面に流れ込むか、別の水域に到達する前に完全に乾きます。,Japanese
小さな川は他のいくつかの名前で呼ばれることもありますが、,Japanese
 小川、小川、小川、小川、小川を含む。,Japanese
川と呼ばれるものを定義する一般的な規則はありません。,Japanese
小さな川の多くの名前は、地理的な場所に固有のものです。,Japanese
 一例は、スコットランドのバーンとイングランド北東部です。,Japanese
川は小川よりも大きいと言われることがありますが、,Japanese
しかし、言葉があいまいであるため、常にそうであるとは限りません。,Japanese
[39] 川は水循環の一部です。,Japanese
河川内の水は、一般に地表流出によって降水から集められます。,Japanese
 地下水涵養、泉、,Japanese
自然の氷や積雪に蓄えられた水の放出（つまり、氷河から）。,Japanese
小川とは、流れのある流れる水域であり、,Japanese
 河床と小川の堤防に閉じ込められています。,Japanese
米国では、小川は幅 60 フィート (18 メートル) 未満の水路として分類されます。,Japanese
小川は水循環の導管として重要であり、,Japanese
 地下水涵養における器具、,Japanese
魚や野生生物の移動の回廊として機能します。,Japanese
小川のすぐ近くにある生物学的生息地は、河岸地帯と呼ばれます。,Japanese
進行中の完新世絶滅の状況を考えると、,Japanese
 小川は、分断された生息地をつなぎ、生物多様性を保全する上で重要な回廊の役割を果たします。,Japanese
一般に、小川や水路の研究には、学際的な自然科学と工学の多くの分野が含まれます。,Japanese
 水文学、河川地形学、水生生態学、,Japanese
 魚の生物学、水辺の生態学など。,Japanese
生態系は、相互に関連して機能するさまざまな生物的および非生物的要素で構成されています。,Japanese
[41] 構造と組成は、相互に関連するさまざまな環境要因によって決定されます。,Japanese
これらの要因の変化は、エコシステムへの動的な変更を開始します。,Japanese
より重要な要素のいくつかは、土壌、大気、,Japanese
 太陽、水、生物からの放射線。,Japanese
生態系の概念の中心にあるのは、生きているか、,Japanese
ガニズムは、ローカル環境の他のすべての要素と相互作用します。,Japanese
生態学の創始者であるユージーン・オダムは、次のように述べています。,Japanese
物理的なものと相互作用する所与の地域の生物（すなわち、「コミュニティ」）,Japanese
 エネルギーの流れが明確に定義された栄養構造につながるような環境、,Japanese
 生物多様性、および物質循環（つまり,Japanese
: システム内の生物と無生物の間の物質の交換) は生態系です。,Japanese
[42] 生態系内では、種は食物連鎖の中で互いにつながり、依存しています。,Japanese
 そして、それらの間だけでなく、それらの環境との間でもエネルギーと物質を交換します。,Japanese
[43] 人間の生態系の概念は、人間/自然に基づいています。,Japanese
 二分法と、すべての種が生態学的に互いに依存しているという考え,Japanese
 ビオトープの非生物的構成要素と同様に。,Japanese
[44] より小さなサイズの単位は、ミクロ生態系と呼ばれます。,Japanese
たとえば、マイクロシステムは石であり、その下にあるすべての生命である可能性があります。,Japanese
マクロ生態系には、生態地域全体が含まれる場合があります。,Japanese
 その排水池で。,Japanese
[45] 荒野は一般に、人間の活動によって大幅に変更されていない地域と定義されています。,Japanese
荒野地域は、保護区、不動産、農場、,Japanese
保護区、牧場、国有林、,Japanese
 国立公園や河川沿いの都市部でも、,Japanese
 峡谷、または未開発の地域。,Japanese
荒野地域と保護公園が考慮されます,Japanese
特定の種の生存、生態学的研究、,Japanese
 保全、そして孤独。,Japanese
一部のネイチャー ライターは、原生地域が人間の精神と創造性にとって不可欠であると信じています。,Japanese
[46] そして一部の生態学者は、原生地域を,Japanese
 地球の自立した自然生態系 (生物圏) の不可欠な部分です。,Japanese
彼らはまた、歴史的な遺伝的形質を保存し、生息地を提供する可能性があります,Japanese
 動物園、樹木園、または研究所で再現することが困難または不可能な野生の動植物。,Japanese
生命の定義について普遍的な合意はありませんが、,Japanese
 科学者は一般に、生命の生物学的発現は組織によって特徴付けられることを認めています。,Japanese
 代謝、成長、適応、刺激への反応、生殖。,Japanese
[47] 生命は単に生物の特徴的な状態であるとも言えます。,Japanese
陸生生物（植物、動物、菌類、原生生物、,Japanese
古細菌、およびバクテリア) は、それらが複雑な組織を持つ細胞性であり、炭素と水に基づいているということです。,Japanese
 新陳代謝、成長、刺激への反応、再生能力を持つこと。,Japanese
これらの特性を持つエンティティは、一般に生命と見なされます。,Japanese
ただし、生命のすべての定義で、これらの特性のすべてが不可欠であると見なされているわけではありません。,Japanese
人間が作った生命の類似物も生命と見なすことができます。,Japanese
生物圏は、土地を含む地球の外殻の一部です。,Japanese
表面の岩石、水、空気、大気 - その中で生命が発生し、,Japanese
 そして、どの生物プロセスが順番に変更または変換されますか。,Japanese
最も広い地球生理学的観点から、,Japanese
 生物圏は、すべての生物とその関係を統合する地球規模の生態系です。,Japanese
リソスフェア (岩石)、水圏 (水)、および大気 (空気) の要素との相互作用を含みます。,Japanese
地球全体には、750 億トン (150 兆ポンドまたは約 6.8×1013 キログラム) のバイオマス (生命) が含まれています。,Japanese
 生物圏のさまざまな環境に生息しています。,Japanese
[48] 地球上の総バイオマスの 10 分の 9 以上が植物であり、,Japanese
 どの動物の生命がその存在を非常に大きく依存しているか。,Japanese
[49] これまでに 200 万種以上の動植物が確認されている [50]。,Japanese
[51][52][53] 生命の個々の種の数は常にある程度流動的であり、,Japanese
 新しい種が出現し、他の種は絶え間なく存在しなくなります。,Japanese
種の総数は急速に減少しています。,Japanese
地球上の生命の起源はよくわかっていませんが、,Japanese
 しかし、少なくとも 35 億年前に発生したことが知られています。,Japanese
原始地球上の冥王代または始生代の時代に,Japanese
 現在見られるものとはかなり異なる環境を持っていました。,Japanese
[64] これらの生命体は基本的な特徴を持っていた,Japanese
 自己複製と継承可能な形質の。,Japanese
生命が誕生すると、自然による進化の過程,Japanese
 選択は、これまで以上に多様な生命体の開発をもたらしました。,Japanese
環境の変化に適応できなかった種,Japanese
 そして他の生命体との競争は消滅した。,Japanese
ただし、化石記録には、これらの古い種の多くの証拠が残っています。,Japanese
現在の化石と DNA の証拠は、現存するすべての種が,Japanese
継続的な祖先を最初の原始生命体までさかのぼることができます。,Japanese
[64] 植物生命の基本的な形態が光合成のプロセスを発達させたとき,Japanese
 太陽のエネルギーを収穫して、より複雑な生命体を可能にする条件を作り出すことができました。,Japanese
[65] その結果、大気中に蓄積された酸素,Japanese
 そしてオゾン層を生み出しました。,Japanese
大きな細胞内に小さな細胞が取り込まれる結果、,Japanese
真核生物と呼ばれるさらに複雑な細胞の発達において。,Japanese
[66] コロニー内の細胞はますます特殊化し、,Japanese
その結果、真の多細胞生物が生まれます。,Japanese
オゾン層が有害な紫外線を吸収し、,Japanese
 生命は地球の表面を植民地化しました。,Japanese
地球上で最初に誕生した生命体は微生物であり、,Japanese
 彼らは約10億人になるまで唯一の生命体であり続けた,Japanese
 多細胞生物が出現し始めた数年前。,Japanese
[67] 微生物は、一般に微視的な単細胞生物であり、,Japanese
 そして人間の目よりも小さい。,Japanese
それらには、細菌、菌類、古細菌、および原生生物が含まれます。,Japanese
これらの生命体は、液体の水がある地球上のほぼすべての場所に見られます。,Japanese
 地球内部も含めて。,Japanese
彼らの繁殖は急速で大量です。」,Japanese
高い突然変異率と水平の組み合わせ,Japanese
 遺伝子導入[69]能力により、適応性が高くなり、,Japanese
 宇宙を含む新しい環境で生き残ることができます。,Japanese
[70] それらは惑星生態系の不可欠な部分を形成します。,Japanese
しかし、一部の微生物は病原性があり、,Japanese
他の生物に健康リスクを与える可能性があります。,Japanese
もともとアリストテレスは、すべての生物を植物に分け、,Japanese
 通常、人間が気付くほど速く動かないものや、動物。,Japanese
リンネのシステムでは、これらは王国になりました,Japanese
 ベジタビリア（後の植物）とアニマル。,Japanese
